{
  "$schema": "https://json-schema.org/draft/2020-12/schema",
  "$id": "https://fabric.local/agent-fabric-evals/route-quality/schemas/case.schema.json",
  "title": "Fabric route-quality case",
  "type": "object",
  "additionalProperties": false,
  "required": [
    "id",
    "route_id",
    "goal",
    "expected"
  ],
  "properties": {
    "id": {
      "type": "string",
      "minLength": 1
    },
    "route_id": {
      "type": "string",
      "minLength": 1
    },
    "ingress": {
      "type": "string",
      "enum": [
        "jobs",
        "chat"
      ]
    },
    "channel": {
      "type": "string"
    },
    "goal": {
      "type": "object"
    },
    "claims": {
      "type": "object"
    },
    "tags": {
      "type": "array",
      "items": {
        "type": "string"
      }
    },
    "expected": {
      "type": "object",
      "additionalProperties": false,
      "required": [
        "stages"
      ],
      "properties": {
        "stages": {
          "type": "array",
          "minItems": 1,
          "items": {
            "type": "object",
            "required": [
              "id"
            ],
            "properties": {
              "id": {
                "type": "string"
              },
              "tool": {
                "type": [
                  "string",
                  "null"
                ]
              },
              "llm_role": {
                "type": "string"
              },
              "type": {
                "type": "string"
              }
            }
          }
        }
      }
    }
  }
}
