{
  "id": "card-freeze-happy",
  "route_id": "card_freeze",
  "ingress": "jobs",
  "channel": "api",
  "goal": {
    "card_id": "crd-eval-1",
    "account_id": "acc-eval-1"
  },
  "claims": {
    "sub": "eval",
    "emts": {
      "cards:freeze": true
    }
  },
  "expected": {
    "stages": [
      {
        "id": "identity",
        "tool": "identity_check",
        "llm_role": "none"
      },
      {
        "id": "limits",
        "tool": "limit_check",
        "llm_role": "none"
      },
      {
        "id": "freeze",
        "tool": "freeze_card",
        "llm_role": "none"
      },
      {
        "id": "respond",
        "llm_role": "synthesis"
      }
    ]
  },
  "tags": [
    "tool-sequence",
    "pattern-2"
  ]
}
